John|3|16|For God so loved the world that he gave his one and only Son, that whoever believes in him shall not perish but have eternal life
Proverbs|3|5|6|Trust in the Lord with all thine heart; and lean not unto thine own understanding. In all thy ways acknowledge him, and he shall direct thy paths.
Philippians|4|13|I can do all things through Christ which strengtheneth me.
Psalm|23|1|3|The Lord is my shepherd; I shall not want. He maketh me to lie down in green pastures: he leadeth me beside the still waters. He restoreth my soul: he leadeth me in the paths of righteousness for his name's sake.
Joshua|1|9|Have not I commanded thee? Be strong and of a good courage; be not afraid, neither be thou dismayed: for the Lord thy God is with thee whithersoever thou goest.
Matthew|5|14|16|Ye are the light of the world. A city that is set on an hill cannot be hid. Neither do men light a candle, and put it under a bushel, but on a candlestick; and it giveth light unto all that are in the house. Let your light so shine before men, that they may see your good works, and glorify your Father which is in heaven.
Romans|8|28|And we know that all things work together for good to them that love God, to them who are the called according to his purpose.
2 Nephi|2|25|Adam fell that men might be; and men are, that they might have joy.